AuthorID,Author,Date,Content,Attachments,Reactions
148370724900306944,jacob_mango,05/08/2019 10:33 AM,@Not A Banana makes it much simpler for editing stamina,,
94846990000594944,QuickZ#5873,05/08/2019 10:34 AM,a const should only protect against reassigning values. Not overriding.,,👍 (1)
368717325484032001,aussiecleetus,05/08/2019 10:35 AM,that's the way it will be next patch 😃,,
368717325484032001,aussiecleetus,05/08/2019 10:35 AM,thank you @Sumrak for getting those wheels rolling,,🍻 (1)
167370568893464576,0x346e3730,05/08/2019 10:37 AM,I think that 1.03 is going to surprise us in a good way,,
148370724900306944,jacob_mango,05/08/2019 10:39 AM,"from what i've seen and heard, for us modders many good ways",,
107560637399306240,cooltrain,05/08/2019 12:57 PM,I know we're going to get one at the time but do we have a changelog of what we expect will be in it? Minus the above ^^,,
368717325484032001,aussiecleetus,05/08/2019 1:16 PM,"Not in detail yet, but I know that there is a LOT coming as far as scripting stands",,👍 (1)
107560637399306240,cooltrain,05/08/2019 1:40 PM,"nice, thats what I want to hear 😄",,
246769426081382400,dallebull,05/08/2019 2:19 PM,Does someone have a tutorial on how to pack or test scrpit files? I'm trying to edit ai.pbo/Config.bin(cpp).,,
148370724900306944,jacob_mango,05/08/2019 2:23 PM,#configs-dayz is what you are looking for,,
246769426081382400,dallebull,05/08/2019 2:23 PM,Typ,,
437549986645803009,Dist|nCoreeee#7365,05/08/2019 7:06 PM,who will help me with this? https://cdn.discordapp.com/attachments/525974941926031360/525975958927441920/41.png,,
437549986645803009,Dist|nCoreeee#7365,05/08/2019 7:07 PM,"what code is needed, enter init.c",,
437549986645803009,Dist|nCoreeee#7365,05/08/2019 7:29 PM,?,,
94846990000594944,QuickZ#5873,05/08/2019 7:33 PM,idk,,
456226577798135808,Deleted User,05/08/2019 9:51 PM,yo i dont know if this question belongs here or not but does anyone if something like a double barrel assault rifle would work? like you can actually shoot 2 bullets at the same time,,
280238592671088640,UnGars#2360,05/08/2019 11:12 PM,Hello ! I have a question: __**how do I do to put an arma 3 garment on dayz?**__ thank you,,
154778237925326848,baroness1,05/08/2019 11:46 PM,you cannot.,,
230061386888118273,.thurston,05/08/2019 11:52 PM,"Well.. You can, as long as you created it in arma 3. If it's default arma 3. No. If it's someone elses. No.",,
154778237925326848,baroness1,05/08/2019 11:52 PM,:feelsGunMan:,,
154778237925326848,baroness1,05/08/2019 11:52 PM,"everyone, when I ask: you can't baroness",,
230061386888118273,.thurston,05/08/2019 11:59 PM,"You can port anything from anywhere as long as **you** created it, or **you** got permission to do so.",,
154778237925326848,baroness1,05/08/2019 11:59 PM,connerie,,
207328818203983872,notabanana,05/09/2019 12:01 AM,"""Well.. You can, as long as you created it in arma 3."" if they made it, they wouldn't have to ask though lol",,
230061386888118273,.thurston,05/09/2019 12:02 AM,"I know, but I've had people come to me who have created assets in arma 3, but were worried about licensing issues. Since it is licensed under APL/SA which states ``Arma only``",,
154778237925326848,baroness1,05/09/2019 12:02 AM,EXACTLY,,
230061386888118273,.thurston,05/09/2019 12:02 AM,"But it is their content, and they can do what the hell they want with it",,
154778237925326848,baroness1,05/09/2019 12:03 AM,but this isnt what he asked tho.,,
463051926406430720,saltybob#3845,05/09/2019 12:31 AM,,https://cdn.discordapp.com/attachments/492295576470290433/575812058285604885/unknown.png,
463051926406430720,saltybob#3845,05/09/2019 12:32 AM,"its objecting about the smelter here:
override bool ActionCondition( PlayerBase player, ActionTarget target, ItemBase item )
    {
        Object targetObject = target.GetObject();
        Smelter_Inductor SmelterInductor = Smelter_Inductor.Cast( targetObject );
        if ( SmelterInductor  &&  SmelterInductor.HasEnergyManager()  &&  SmelterInductor.GetCompEM().CanSwitchOn()  &&  SmelterInductor.GetCompEM().CanWork() )
as far as i can tell im using the correct class name (Smelter_Inductor) in the correct way?",,
230061386888118273,.thurston,05/09/2019 12:35 AM,``Smelter_Inductor`` is an unknown type,,
463051926406430720,saltybob#3845,05/09/2019 12:35 AM,the Smelter_Inductor is in another pbo RPRZ_Items,,
463051926406430720,saltybob#3845,05/09/2019 12:35 AM,is that the reason itt cant see the type do you think?,,
230061386888118273,.thurston,05/09/2019 12:36 AM,"I think so, I don't know too much about how scripts interact with other PBOs.",,
463051926406430720,saltybob#3845,05/09/2019 12:36 AM,i know that crafting recipes can interact across so i had hoped same would be true for actions,,
463051926406430720,saltybob#3845,05/09/2019 1:54 AM,solved. on to a new problem 😃,,
575954046054301696,lucianpin,05/09/2019 10:03 AM,"Hi, please someone if could help me with this. I am writting a  new mod, how can I determine if will be in conflict with Trader mod? Is it all about class methods calling super or not? And in which order? Or is there something else too?",,
158294510080753665,gravitywolf,05/09/2019 10:55 AM,"No class names can be shared, but that's with every mod..",,
402077901174079499,munghard,05/09/2019 10:59 AM,"hey what is the proper way of adding items to recipies ie. open can, craft rag. so that it doesn't disrupt anything?",,
575954046054301696,lucianpin,05/09/2019 12:25 PM,@GravityWolf Thank you for answer. So really only the last loaded mod in chain will derive a class? All other previous mods for that class are dropped?,,
102121607417327616,rvn,05/09/2019 12:37 PM,"@Lucian Nope, check this  https://community.bistudio.com/wiki/DayZ:Enforce_Script_Syntax#Modded_class",,👍 (1)
575954046054301696,lucianpin,05/09/2019 12:38 PM,@rVn Thank you!,,
158294510080753665,gravitywolf,05/09/2019 12:45 PM,@rVn ❤,,
135355238990348288,djctavia,05/09/2019 12:46 PM,"Ok, so I have the weirdest bug you can have I think, but every time the server launches my script, it tells me ""bad type"" on classes already existing in DayZ and changes errors with each compilation without touching the code, I should worry? 😂",,
135355238990348288,djctavia,05/09/2019 2:32 PM,"@Arkensor @Jacob_Mango  Sorry to bother you, but is that normal ? I redownload it just for being sure but it seem it's missing a letter",https://cdn.discordapp.com/attachments/492295576470290433/576023733282668555/unknown.png,
181864632216977408,arkensor,05/09/2019 2:34 PM,>.> yeah thats a typo,,
135355238990348288,djctavia,05/09/2019 2:35 PM,Oh god... I thought I had another issue 😂,,
148370724900306944,jacob_mango,05/09/2019 3:09 PM,@Arkensor @DjCtavia ive already fixed it on github (with backwards compatiblility). It'll be on steam with 1.03 dayz stable update.,,
135355238990348288,djctavia,05/09/2019 3:11 PM,Ok ^^ Thank's,,
341206044216918019,lagtek,05/09/2019 9:12 PM,"hey, lil question maybe u will be able to help me. Do u know if there is a way to track number of killed players or zombies ?",,
167370568893464576,0x346e3730,05/09/2019 9:15 PM,"with JSON and EEKilled in EntityAI, yes",,
207328818203983872,notabanana,05/09/2019 9:19 PM,"Couldnt you just have it as a variable like ""zombieskilled"" and write that to db?",,
167370568893464576,0x346e3730,05/09/2019 9:22 PM,"maybe, never played with db, would be way easier yes",,
167370568893464576,0x346e3730,05/09/2019 9:22 PM,but you couldnt access it to display it on a website then,,
341206044216918019,lagtek,05/09/2019 11:37 PM,"never played with db, no idea to how to do that even if i think dat it should be better.",,
94846990000594944,QuickZ#5873,05/09/2019 11:53 PM,"Why would you not be able to access the db? I mean if you mean directly, then its the same for the json-file",,
94846990000594944,QuickZ#5873,05/09/2019 11:56 PM,Db > json,,
167370568893464576,0x346e3730,05/10/2019 12:01 AM,can you access the game's db with anything outside ?,,
167370568893464576,0x346e3730,05/10/2019 12:01 AM,"like, can I read from it with PHP or NodeJs ? I highly doubt it",,
94846990000594944,QuickZ#5873,05/10/2019 12:02 AM,Ofcourse. Its a db,,
94846990000594944,QuickZ#5873,05/10/2019 12:06 AM,Specificly a sql relational db. Just rock n roll,,
105574798691680256,totallynotgrim,05/10/2019 12:12 AM,only problem is that actual data is in binary form,,
105574798691680256,totallynotgrim,05/10/2019 12:12 AM,That is kinda annoying to keep up to date if you want to explore that data,,
94846990000594944,QuickZ#5873,05/10/2019 12:14 AM,Zombieskilled  should be int,,
230061386888118273,.thurston,05/10/2019 12:21 AM,https://thurston.pw/i/ogut9.png :Thonk: what great data!,,
94846990000594944,QuickZ#5873,05/10/2019 12:32 AM,Thats binary data.,,
94846990000594944,QuickZ#5873,05/10/2019 12:32 AM,Blob,,
94846990000594944,QuickZ#5873,05/10/2019 12:33 AM,Have a custom field,,
230061386888118273,.thurston,05/10/2019 12:34 AM,"I had an idea, but there is probably no way to convert to plain text",,
167370568893464576,0x346e3730,05/10/2019 12:37 AM,I'm just waiting for official hive thing to comes out for those,,
207328818203983872,notabanana,05/10/2019 12:38 AM,"Unrelated, but does that playtime stat actually work?",,
230061386888118273,.thurston,05/10/2019 12:41 AM,"I'd imagine it does, but since Navicat can't read the data properly, we don't know how its stored. @Happy you got any idea for reading the .db files?",,
148370724900306944,jacob_mango,05/10/2019 12:41 AM,Sqlite,,
105574798691680256,totallynotgrim,05/10/2019 12:41 AM,Yes,,
230061386888118273,.thurston,05/10/2019 12:41 AM,"Navicat can read most of it, but as you can see in the screenshot above it's fucked",,
105574798691680256,totallynotgrim,05/10/2019 12:41 AM,But that is just a binary blob,,
105574798691680256,totallynotgrim,05/10/2019 12:41 AM,You would need to reverse it,,
105574798691680256,totallynotgrim,05/10/2019 12:41 AM,To get what data actually is,,
230061386888118273,.thurston,05/10/2019 12:41 AM,urgh,,
105574798691680256,totallynotgrim,05/10/2019 12:42 AM,Hint its almost a flat memory dump of a player,,
105574798691680256,totallynotgrim,05/10/2019 12:42 AM,:LUL:,,
230061386888118273,.thurston,05/10/2019 12:42 AM,"That's fine tbh, I have an idea, but I want to display all of the player info",,
105574798691680256,totallynotgrim,05/10/2019 12:42 AM,That is all the info you web developer,,
105574798691680256,totallynotgrim,05/10/2019 12:42 AM,:FeelsOkaayMan:,,
94846990000594944,QuickZ#5873,05/10/2019 12:42 AM,If it can store dead and alive as int there should be write and read support as querys,,
230061386888118273,.thurston,05/10/2019 12:42 AM,"yes, i know it is",,
230061386888118273,.thurston,05/10/2019 12:43 AM,just i need to learn in 5 minutes how to reverse a binary blob :feelsthinkman:,,
105574798691680256,totallynotgrim,05/10/2019 12:43 AM,I mean i know how i would do it,,
105574798691680256,totallynotgrim,05/10/2019 12:43 AM,:hmm:,,
230061386888118273,.thurston,05/10/2019 12:43 AM,You able to help with that?,,
230061386888118273,.thurston,05/10/2019 12:44 AM,Because my idea will help people greatly :MonkaFeelsGreatMan:,,
105574798691680256,totallynotgrim,05/10/2019 12:44 AM,Its a PITA thing to do and i have a feeling it updates constantly,,
105574798691680256,totallynotgrim,05/10/2019 12:44 AM,Also helping people :FeelsWeirdMan:,,
94846990000594944,QuickZ#5873,05/10/2019 12:44 AM,Why reverse the blob?,,
94846990000594944,QuickZ#5873,05/10/2019 12:44 AM,You want the data,,
105574798691680256,totallynotgrim,05/10/2019 12:44 AM,What do you mean,,
230061386888118273,.thurston,05/10/2019 12:44 AM,"I could make a function to do it in runtime, would be aids, probably cause some issues, but I wouldn't know until I test",,
105574798691680256,totallynotgrim,05/10/2019 12:45 AM,Binary blob means nothing without a context,,
105574798691680256,totallynotgrim,05/10/2019 12:45 AM,Its memory,,
105574798691680256,totallynotgrim,05/10/2019 12:45 AM,Tbh its probably quite easy to reverse,,
94846990000594944,QuickZ#5873,05/10/2019 12:47 AM,You will need to fetch or grab needed data and store it in runtime to custom tables and fields,,
105574798691680256,totallynotgrim,05/10/2019 12:48 AM,What are you talking about?,,
167370568893464576,0x346e3730,05/10/2019 12:48 AM,will probably change with 1.03,,
230061386888118273,.thurston,05/10/2019 12:48 AM,"It probably will, hence why I want to just get the base idea working now. I can update what I'm planning to do as I go along",,
94846990000594944,QuickZ#5873,05/10/2019 12:50 AM,Talking about not working against blobs,,
94846990000594944,QuickZ#5873,05/10/2019 12:50 AM,"Instead work with data stored as datatypes,",,
94846990000594944,QuickZ#5873,05/10/2019 12:52 AM,If dayz already store alive as int why should we reverse and extract complete blobs?,,
94846990000594944,QuickZ#5873,05/10/2019 12:52 AM,Should be some compability.,,
105574798691680256,totallynotgrim,05/10/2019 12:53 AM,What are you guys trying to do? As most of that blob is from the scripting engine,,
94846990000594944,QuickZ#5873,05/10/2019 12:56 AM,Lagtek wanted to store kills,,
239201186933112833,da0ne_,05/10/2019 12:57 AM,"Figure out the save sequence of a player...replicate it....use serializer to read already saved data = profit? 


I’m so late to this discussion I shall no longer contribute :slicKkona:",,
230061386888118273,.thurston,05/10/2019 12:57 AM,I'm making an admin panel :)),,
239201186933112833,da0ne_,05/10/2019 12:57 AM,:feelsGunMan:,,
230061386888118273,.thurston,05/10/2019 12:58 AM,And I'm wondering how that data can be manipulated.,,
239201186933112833,da0ne_,05/10/2019 12:58 AM,What admin panel? DayZ or external ?,,
230061386888118273,.thurston,05/10/2019 12:58 AM,For DayZ,,
230061386888118273,.thurston,05/10/2019 12:58 AM,(obviously),,
230061386888118273,.thurston,05/10/2019 12:58 AM,But it's going to be web-based,,
239201186933112833,da0ne_,05/10/2019 12:58 AM,That’s what I meant lol,,
239201186933112833,da0ne_,05/10/2019 12:58 AM,DayZ no shit. But external yes,,
230061386888118273,.thurston,05/10/2019 12:58 AM,😄,,
239201186933112833,da0ne_,05/10/2019 12:58 AM,:OmegaPog:,,
230061386888118273,.thurston,05/10/2019 12:59 AM,I'm thinking,,
239201186933112833,da0ne_,05/10/2019 1:00 AM,@thurston honestly just wait for the damn db tools *funny Pepe here*,,
230061386888118273,.thurston,05/10/2019 1:00 AM,in PHP,,
230061386888118273,.thurston,05/10/2019 1:00 AM,I can do blob->utf8,,
230061386888118273,.thurston,05/10/2019 1:00 AM,but idk if php will even read the blob,,
230061386888118273,.thurston,05/10/2019 1:00 AM,might just fuck up and only take the plain text,,
167370568893464576,0x346e3730,05/10/2019 1:00 AM,ofc it will,,
239201186933112833,da0ne_,05/10/2019 1:00 AM,Try 🍝,,
167370568893464576,0x346e3730,05/10/2019 1:00 AM,why wouldn't it,,
167370568893464576,0x346e3730,05/10/2019 1:00 AM,buuuut,,
167370568893464576,0x346e3730,05/10/2019 1:00 AM,be carefull,,
167370568893464576,0x346e3730,05/10/2019 1:00 AM,dayz and utf8,,
167370568893464576,0x346e3730,05/10/2019 1:00 AM,ugh,,
230061386888118273,.thurston,05/10/2019 1:01 AM,"I know, my idea now is to take the db contents, in php convert blob->utf8, show user, user changes some data, convert from utf8->blob (if that's even possible), and insert new data into db.",,
94846990000594944,QuickZ#5873,05/10/2019 1:01 AM,Wait for what db? You know stuff? :feelsGunMan:,,
230061386888118273,.thurston,05/10/2019 1:02 AM,players.db,,
230061386888118273,.thurston,05/10/2019 1:02 AM,https://thurston.pw/i/mv03k.png,,
230061386888118273,.thurston,05/10/2019 1:02 AM,"I don't even know if you can manipulate this data, right now",,
230061386888118273,.thurston,05/10/2019 1:02 AM,"Might just corrupt the player, who knows!",,
94846990000594944,QuickZ#5873,05/10/2019 1:02 AM,What db are we waiting for?,,
230061386888118273,.thurston,05/10/2019 1:03 AM,hive db tools,,
94846990000594944,QuickZ#5873,05/10/2019 1:03 AM,All my plans depends on db so that would be sexy,,
105574798691680256,totallynotgrim,05/10/2019 1:04 AM,Oh that,,
105574798691680256,totallynotgrim,05/10/2019 1:04 AM,you can store and load whatever you want in it,,
239201186933112833,da0ne_,05/10/2019 1:04 AM,^,,
94846990000594944,QuickZ#5873,05/10/2019 1:04 AM,When oO,,
105574798691680256,totallynotgrim,05/10/2019 1:04 AM,Even from script,,
239201186933112833,da0ne_,05/10/2019 1:05 AM,It’s actually better than json in some instances,,
239201186933112833,da0ne_,05/10/2019 1:05 AM,Anything but json :OmegaPog:,,
105574798691680256,totallynotgrim,05/10/2019 1:05 AM,"void OnStoreLoad(ParamsReadContext ctx, int version)",,
105574798691680256,totallynotgrim,05/10/2019 1:05 AM,void OnStoreSave(ParamsWriteContext ctx),,
105574798691680256,totallynotgrim,05/10/2019 1:05 AM,That is what you need,,
105574798691680256,totallynotgrim,05/10/2019 1:05 AM,Every entity has it,,guh (1)
94846990000594944,QuickZ#5873,05/10/2019 1:06 AM,Json is awesome for transfering data. But please i need storage simple 😬,,
239201186933112833,da0ne_,05/10/2019 1:06 AM,You can use it on an entity/object inherent,,
94846990000594944,QuickZ#5873,05/10/2019 1:07 AM,Write ctx? No table no fields?,,
105574798691680256,totallynotgrim,05/10/2019 1:07 AM,There is no tables,,
105574798691680256,totallynotgrim,05/10/2019 1:07 AM,Its just sterilized data,,
94846990000594944,QuickZ#5873,05/10/2019 1:08 AM,😐,,
94846990000594944,QuickZ#5873,05/10/2019 1:09 AM,So hive db tools.. Its a confirmed thing?,,
230061386888118273,.thurston,05/10/2019 1:10 AM,"Yeah, just don't know when",,
230061386888118273,.thurston,05/10/2019 1:10 AM,Much like everything else,,
230061386888118273,.thurston,05/10/2019 1:10 AM,"A lot of stuff is ""confirmed"" to be coming",,
94846990000594944,QuickZ#5873,05/10/2019 1:10 AM,And it will give us custom read and write support to db?,,
230061386888118273,.thurston,05/10/2019 1:10 AM,Just no date,,
105574798691680256,totallynotgrim,05/10/2019 1:10 AM,I just cant wait until 2 mods store smt in the DB,,
105574798691680256,totallynotgrim,05/10/2019 1:10 AM,And for whatever reason load order changes,,
105574798691680256,totallynotgrim,05/10/2019 1:10 AM,:rip:,,
230061386888118273,.thurston,05/10/2019 1:10 AM,and that's a big rip to the DB!,,
94846990000594944,QuickZ#5873,05/10/2019 1:12 AM,Frustrating,,
230061386888118273,.thurston,05/10/2019 1:56 AM,@0x346e3730 I just found the answer ``fbsql_read_blob``,,👍 (1)
135355238990348288,djctavia,05/10/2019 8:56 AM,"At least we know that will be there, I'd rather know that than wait for nothing ^^",,
427419739787362304,Funkdoc#1677,05/10/2019 6:11 PM,"hi guys, is there a possibility to save a file outside the logs / profile folder on a server by script? the problem is when the file number of this folder exceeds, no file creation from script  is possible anymore. I know periodically deletion of old logfile will just do it but i want to prevent it in case.",,
368717325484032001,aussiecleetus,05/10/2019 7:39 PM,Only eay is to have the admin or players create a folder for it to use in the profile,,
368717325484032001,aussiecleetus,05/10/2019 7:40 PM,Because we cannot create folders in code (it was disabled),,
239201186933112833,da0ne_,05/10/2019 7:50 PM,"Logs should be ignored...🤔
BI pls fix?",,
210193317248368640,joeoftex,05/10/2019 7:53 PM,Can you do $profile/../,,
208096025368330241,therealmass,05/10/2019 8:19 PM,http://prntscr.com/nmxl1x,,
208096025368330241,therealmass,05/10/2019 8:19 PM,with the new 1.03 with the pluginrecipemanager,,
208096025368330241,therealmass,05/10/2019 8:19 PM,if anyone knows what to do ping me @Mass,,
402438795825381376,namalsksurvivor,05/10/2019 8:22 PM,"I believe this is tied to:
Changed: Greatly optimized RecipeCache, now built automatically on startup (mods no longer require to rebuild it when adding custom recipes)
@Mass",,
167370568893464576,0x346e3730,05/10/2019 8:22 PM,It is for sure,,
208096025368330241,therealmass,05/10/2019 8:29 PM,"that sounds fantastic, But I'm not sure if this means I should even be doing this now or not",,
167370568893464576,0x346e3730,05/10/2019 8:30 PM,Apparently there's no need to force refresh the cache,,
167370568893464576,0x346e3730,05/10/2019 8:30 PM,so try to just remove the cache part ?,,
208096025368330241,therealmass,05/10/2019 8:30 PM,so basically JUST registerrecipies?,,
167370568893464576,0x346e3730,05/10/2019 8:30 PM,yeah,,
208096025368330241,therealmass,05/10/2019 8:30 PM,can't hurt to try,,
208096025368330241,therealmass,05/10/2019 9:04 PM,It worked like a charm.,,
208096025368330241,therealmass,05/10/2019 9:05 PM,so anyone who comes to this thread for the same reason I did to fix their recipes just do that,,
167370568893464576,0x346e3730,05/10/2019 9:06 PM,😄,,
107560637399306240,cooltrain,05/10/2019 9:24 PM,I take it the old action system is now deprecated?,,
107560637399306240,cooltrain,05/10/2019 9:25 PM,Do we have any info on the new one?,,
107560637399306240,cooltrain,05/10/2019 9:25 PM,ᵂʰᵒ ᵃᵐ ᴵ ᴷᶦᵈᶦⁿᵍ ᵒᶠ ᶜᵒᵘʳˢᵉ ʷᵉ ᵈᵒⁿ'ᵗ,,
235718406492520448,niirozz,05/10/2019 9:28 PM,use AddAction on object itself,,
235718406492520448,niirozz,05/10/2019 9:28 PM,and should do the trick,,
235718406492520448,niirozz,05/10/2019 9:29 PM,but it's the same you need to override ActionConstructor,,
107560637399306240,cooltrain,05/10/2019 9:32 PM,Seems like a new RegisterActions function in actionconstructor,,
235718406492520448,niirozz,05/10/2019 9:34 PM,"No, it's exactly the same, if I checked it right",,
210031922049581056,.nehr,05/10/2019 9:34 PM,//i did just undersand and realise that my question was realy stupid x),,
235718406492520448,niirozz,05/10/2019 9:35 PM,Override RegisterActions @Cooltrain,,
235718406492520448,niirozz,05/10/2019 9:36 PM,Look at code and take the things inside the ifndef,,
107560637399306240,cooltrain,05/10/2019 9:36 PM,Yep having a look now,,
235718406492520448,niirozz,05/10/2019 9:38 PM,That's looks more simple than before,,
107560637399306240,cooltrain,05/10/2019 9:39 PM,Do we know if we need to make any config changes?,,
235718406492520448,niirozz,05/10/2019 9:39 PM,"Pretty sure not, but take a look",,
235718406492520448,niirozz,05/10/2019 9:40 PM,maybe changed name,,
135355238990348288,djctavia,05/10/2019 9:40 PM,"Well, I can't do debug phases that last 3 years to debug a simple reference. Then a little help would be greatly appreciated!

Someone would be able to explain to me the reason for a pointer that is NULL when the array in question uses a ""ref"" and its members as well? I really have that impression there are things that have trouble compiling, the code only returned NULL points, I recompile without touching the code, launch the server and the client, and it works, but in the logs always the same pointer line with an error when everything is displayed as I hoped. I recompile, and again a pointer problem but this time I no longer have the display of what I expect.

Concretely I point to a class reference, at its creation I use a ""string"" to fill a member variable which is also a ""string"" type.

To initialize a new class in my array I do this:

```
// This one is inside another class but for understanding I put it there as an exemple
ref array<ref PM_playerInList> myArray = new ref array<ref PM_playerInList>;
// There is code beyond but don't mind
ref PM_playerInList n_player;

        while (element_index < playersArray.Count())
        {
            n_player = new ref PM_playerInList(playersArray[element_index+1]);
            myArray.Insert(n_player );
// etc...
```
This is a simplified example, so I doubt I'm stupid I've been programming for a while, but I'm starting to wonder about enscript, with the ""ref"" I thought I'd use them as standard pointers that can be found more or less in C, but I clearly have the impression that it's totally random every time I compile and test phases on large modules.

If someone would at least have the idea of the reason for the NULL pointer when everything is initialized, that would be really nice.",,
107560637399306240,cooltrain,05/10/2019 9:46 PM,@NiiRoZz All working now no config changes needed. Just override RegisterActions and call AddAction on the target. Aces 😄,,
107560637399306240,cooltrain,05/10/2019 9:47 PM,just need to go though and make some new classes for all my items now and it should be done,,
235718406492520448,niirozz,05/10/2019 9:48 PM,"Yeah, and way easier too",,
235718406492520448,niirozz,05/10/2019 9:48 PM,Maybe config is not needed anymore too,,
235718406492520448,niirozz,05/10/2019 9:49 PM,@Cooltrain,,
107560637399306240,cooltrain,05/10/2019 9:50 PM,I think you still need the config line to register it to the const,,
235718406492520448,niirozz,05/10/2019 9:51 PM,Maybe don't know,,
235718406492520448,niirozz,05/10/2019 9:51 PM,Didn't checked in depth,,
402438795825381376,namalsksurvivor,05/10/2019 9:51 PM,no need for configs afaik,,
107560637399306240,cooltrain,05/10/2019 9:51 PM,Oh really? I'll test it now ^^,,
